{
  "schemaVersion": "1.0.0",
  "transactionId": "txn_metrics_v9",
  "state": "cache-rebuilt",
  "projectId": "project_metrics",
  "documentId": "doc_dashboard",
  "requestId": "req_metrics_cards",
  "attemptId": "attempt_001",
  "basedOnVersionId": "ver_0005",
  "previousVersionId": "ver_0008",
  "candidateVersionId": "ver_0009",
  "candidateVersionOrdinal": 9,
  "candidateVersionLabel": "V9",
  "baseSnapshotSha256": "sha256:bbbbbbbbbbbbbbbbbbbbbbbbbbbbbbbbbbbbbbbbbbbbbbbbbbbbbbbbbbbbbbbb",
  "expectedSourceSha256": "sha256:bbbbbbbbbbbbbbbbbbbbbbbbbbbbbbbbbbbbbbbbbbbbbbbbbbbbbbbbbbbbbbbb",
  "candidateContentSha256": "sha256:cccccccccccccccccccccccccccccccccccccccccccccccccccccccccccccccc",
  "candidateManifestSha256": "sha256:8888888888888888888888888888888888888888888888888888888888888888",
  "completionSha256": "sha256:9999999999999999999999999999999999999999999999999999999999999999",
  "completionRelativePath": "requests/req_metrics_cards/attempts/attempt_001/completion.json",
  "paths": {
    "preparedVersionRelativePath": "transactions/txn_metrics_v9/prepared-version",
    "recoverySourceRelativePath": "transactions/txn_metrics_v9/recovery/source.html",
    "publishedVersionRelativePath": "versions/ver_0009",
    "commitMarkerRelativePath": "versions/ver_0009/committed.json"
  },
  "recoverySourceSha256": "sha256:bbbbbbbbbbbbbbbbbbbbbbbbbbbbbbbbbbbbbbbbbbbbbbbbbbbbbbbbbbbbbbbb",
  "preparedAt": "2026-07-17T08:41:02Z",
  "sourceAppliedAt": "2026-07-17T08:41:10Z",
  "versionPublishedAt": "2026-07-17T08:41:20Z",
  "versionGeneratedAt": "2026-07-17T08:41:30Z",
  "committedAt": "2026-07-17T08:41:30Z",
  "cacheRebuiltAt": "2026-07-17T08:41:31Z",
  "createdAt": "2026-07-17T08:41:00Z",
  "updatedAt": "2026-07-17T08:41:31Z"
}
