{
  "schemaVersion": "1.0.0",
  "transactionId": "txn_external_kept",
  "state": "external-kept",
  "projectId": "project_metrics",
  "documentId": "doc_dashboard",
  "requestId": "req_external_kept",
  "attemptId": "attempt_001",
  "basedOnVersionId": "ver_0005",
  "previousVersionId": "ver_0008",
  "candidateVersionId": "ver_0009",
  "candidateVersionOrdinal": 9,
  "candidateVersionLabel": "V9",
  "baseSnapshotSha256": "sha256:bbbbbbbbbbbbbbbbbbbbbbbbbbbbbbbbbbbbbbbbbbbbbbbbbbbbbbbbbbbbbbbb",
  "expectedSourceSha256": "sha256:bbbbbbbbbbbbbbbbbbbbbbbbbbbbbbbbbbbbbbbbbbbbbbbbbbbbbbbbbbbbbbbb",
  "candidateContentSha256": "sha256:cccccccccccccccccccccccccccccccccccccccccccccccccccccccccccccccc",
  "candidateManifestSha256": "sha256:8888888888888888888888888888888888888888888888888888888888888888",
  "completionSha256": "sha256:2020202020202020202020202020202020202020202020202020202020202020",
  "completionRelativePath": "requests/req_external_kept/attempts/attempt_001/completion.json",
  "paths": {
    "preparedVersionRelativePath": "transactions/txn_external_kept/prepared-version",
    "recoverySourceRelativePath": "transactions/txn_external_kept/recovery/source.html",
    "publishedVersionRelativePath": "versions/ver_0009",
    "commitMarkerRelativePath": "versions/ver_0009/committed.json"
  },
  "observedSourceSha256": "sha256:1313131313131313131313131313131313131313131313131313131313131313",
  "conflictDetectedAt": "2026-07-17T09:29:00Z",
  "terminalSourceSha256": "sha256:1313131313131313131313131313131313131313131313131313131313131313",
  "commitMarkerAbsentVerified": true,
  "resolvedAt": "2026-07-17T09:30:00Z",
  "createdAt": "2026-07-17T09:28:00Z",
  "updatedAt": "2026-07-17T09:30:00Z"
}
